{
  "$schema": "http://json-schema.org/draft-07/schema#",
  "title": "Scrum framework configuration",
  "description": "Schema for .scrum/config.json. Pipeline keys (test_runner, coverage_tool, pragma_pattern, path_guard, merge_regression, detectors, static_analysis) and the stall_watchdog block are now described here; per-language sub-objects keep additionalProperties:true so language keys stay free-form. Top-level additionalProperties stays true so unforeseen keys don't force a migration. The autonomous-PO keys (po_mode, po, autonomous) are constrained. The per-seat LLM table (agents) is the SSOT for provider+model selection (see docs/contracts/model-catalog.json).",
  "type": "object",
  "additionalProperties": true,
  "properties": {
    "test_runner": {
      "description": "Per-language test command templates ({pbi_id}, {round} substituted). Read by the pbi-pipeline skill / quality-gate.sh.",
      "type": "object",
      "additionalProperties": true
    },
    "coverage_tool": {
      "description": "Per-language coverage tool. null disables the coverage gate project-wide.",
      "type": [
        "object",
        "null"
      ],
      "additionalProperties": true
    },
    "pragma_pattern": {
      "description": "Pragma marker for the coverage pragma-audit step. A plain string (single global marker, as in .scrum-config.example.json) or an object keyed per language. Consumers MUST branch on the shape: a bare `jq -r` yields the JSON text for the object form and the literal `null` when absent, either of which makes the pragma audit match nothing and pass vacuously. See skills/pbi-pipeline/references/coverage-gate.md step (e).",
      "type": [
        "string",
        "object"
      ],
      "additionalProperties": true
    },
    "c0_threshold": {
      "description": "Minimum C0 (statement) coverage percent required by the coverage gate. Percent scale, compared against coverage-rN.json .totals.c0.percent. Defaults to 100 when absent.",
      "type": "integer",
      "minimum": 0,
      "maximum": 100
    },
    "c1_threshold": {
      "description": "Minimum C1 (branch) coverage percent required by the coverage gate. Percent scale, compared against coverage-rN.json .totals.c1.percent, and only when .totals.c1.supported is true. Partial-C1 languages (Go, Rust, Bash) MUST declare a relaxed value here rather than relaxing ad hoc. Defaults to 100 when absent — note that a misspelled key therefore silently reinstates the 100% requirement.",
      "type": "integer",
      "minimum": 0,
      "maximum": 100
    },
    "path_guard": {
      "description": "impl_globs[] and test_globs[] consumed by pre-tool-use-path-guard.sh for pbi-implementer / pbi-ut-author.",
      "type": "object",
      "additionalProperties": true,
      "properties": {
        "impl_globs": {
          "type": "array",
          "items": {
            "type": "string"
          }
        },
        "test_globs": {
          "type": "array",
          "items": {
            "type": "string"
          }
        }
      }
    },
    "merge_regression": {
      "description": "command run by merge-pbi.sh after each per-PBI merge; skipped with WARN when absent. Written only via set-merge-regression-command.sh (Sprint-Planning decision).",
      "type": "object",
      "additionalProperties": true,
      "properties": {
        "command": {
          "type": [
            "string",
            "null"
          ]
        },
        "accepted_none": {
          "description": "true = the team deliberately runs no per-PBI regression gate (recorded via set-merge-regression-command.sh --none). Distinguishes an explicit opt-out from a never-decided unset gate, so merge-pbi.sh drops its WARN to a quiet note. Not required; absent/false means the gate is either configured or undecided.",
          "type": "boolean"
        }
      }
    },
    "detectors": {
      "description": "Guard-first codebase-audit detector settings. The detector COMMANDS themselves are not configured here — they live in .scrum/audit-ledger.json (classes[].detector.command, written only by update-audit-ledger.sh); this block only bounds their execution. Read by scripts/scrum/run-detectors.sh, which merge-pbi.sh runs as a merge gate and the smoke-test skill records as the `detectors` test category.",
      "type": "object",
      "additionalProperties": true,
      "properties": {
        "timeout_seconds": {
          "description": "Per-detector wall-clock budget in seconds. A detector that exceeds it is killed and counted as could-not-execute (runner exit 2), which FAILS the merge gate — a timing-out ratchet is a failure, never a pass. Defaults to 120 when absent; a non-integer or non-positive value falls back to the same default rather than disabling the bound.",
          "type": "integer",
          "minimum": 1
        }
      }
    },
    "static_analysis": {
      "description": "Project-declared reachability / dead-export commands for the cross-review whole-repo dead-code pass (feeds the `redundancy` audit axis). Each command runs via `bash -c` from the repo root; stdout+exit are aggregated into .scrum/reviews/static-analysis-r{n}.json. When commands[] is absent or empty, the pass falls back to the built-in Python `vulture` auto-run (when available). Meant for languages the built-in pass does not cover (e.g. knip / ts-prune for TypeScript, staticcheck for Go, cargo-udeps for Rust).",
      "type": "object",
      "additionalProperties": true,
      "properties": {
        "commands": {
          "type": "array",
          "items": {
            "type": "object",
            "additionalProperties": true,
            "properties": {
              "name": {
                "type": "string"
              },
              "command": {
                "type": "string"
              }
            }
          }
        }
      }
    },
    "stall_watchdog": {
      "description": "PBI activity-monitor settings. The external tmux handoff daemon uses them in human mode; the autonomous outer watchdog consumes the per-PBI threshold without launching a second monitor or LLM check.",
      "type": "object",
      "additionalProperties": false,
      "properties": {
        "enabled": {
          "type": "boolean"
        },
        "idle_threshold_minutes": {
          "description": "Legacy-compatible idle threshold and default for pbi_idle_threshold_minutes. The monitor's default is 30 minutes.",
          "type": "integer",
          "minimum": 1
        },
        "pbi_idle_threshold_minutes": {
          "description": "Per-PBI activity threshold used by the read-only pbi-idle reporter. Fresh polls are silent; stale or unknown results request a bounded Explorer handoff. Defaults to idle_threshold_minutes (30 minutes by default).",
          "type": "integer",
          "minimum": 1
        },
        "cooldown_minutes": {
          "type": "integer",
          "minimum": 1
        },
        "poll_interval_seconds": {
          "type": "integer",
          "minimum": 1
        }
      }
    },
    "framework_issue": {
      "description": "Settings for .scrum/scripts/draft-framework-issue.sh (the Retrospective's upstream leg). Optional; absent means only the built-in sanitizer checks apply.",
      "type": "object",
      "additionalProperties": true,
      "properties": {
        "forbidden_tokens": {
          "description": "Operator-maintained denylist of domain terms that must never leave this project. The wrapper rejects a draft containing any of them (case-insensitive substring). This is the only mechanical defense against the leak class no pattern can catch — a business noun that is meaningless outside this project. Nothing forces the list to be populated; an empty or absent list leaves the human review gate as the sole guard.",
          "type": "array",
          "items": {
            "type": "string"
          }
        }
      }
    },
    "po_mode": {
      "description": "Who plays the Product Owner role. 'human' = wait for user input at PO decision points (default when key absent). 'agent' = a Claude teammate (product-owner) decides automatically.",
      "enum": [
        "human",
        "agent"
      ]
    },
    "po": {
      "type": "object",
      "additionalProperties": false,
      "properties": {
        "max_clarification_rounds": {
          "description": "How many clarification round-trips with SM before the PO must commit a decision under best-effort.",
          "type": "integer",
          "minimum": 0
        },
        "max_integration_cycles": {
          "description": "Maximum number of integration→development defect-fix cycles (Integration Tests / UAT & Release loop) before releasing as-is or aborting.",
          "type": "integer",
          "minimum": 0
        }
      }
    },
    "autonomous": {
      "type": "object",
      "additionalProperties": false,
      "properties": {
        "max_iterations": {
          "type": "integer",
          "minimum": 1
        },
        "max_wall_clock_hours": {
          "type": "number",
          "minimum": 0
        },
        "max_sprints": {
          "type": "integer",
          "minimum": 1
        },
        "max_consecutive_failures": {
          "type": "integer",
          "minimum": 1
        },
        "stop_block_budget_per_phase": {
          "type": "integer",
          "minimum": 1
        },
        "permission_mode": {
          "enum": [
            "dontAsk",
            "bypassPermissions"
          ]
        },
        "notify_command": {
          "type": [
            "string",
            "null"
          ]
        },
        "fallback_model": {
          "type": [
            "string",
            "null"
          ]
        }
      }
    },
    "agents": {
      "description": "Per-seat LLM provider + model. SSOT for model selection; written only by agent-models.sh (scrum-start.sh on every launch; migrations/009-seed-agent-models.sh as the legacy import). For claude seats the deployed .claude/agents/*.md `model:`/`effort:` lines are a materialized view of this table; codex-reviewers.model is passed as `codex exec -m` by codex-invoke.sh (null = Codex CLI default). Seat membership, defaults and known model ids: docs/contracts/model-catalog.json. Absent block or absent seat = catalog default. developer is Claude-only by design (the pbi-pipeline conductor needs the Claude Agent tool).",
      "type": "object",
      "additionalProperties": false,
      "properties": {
        "scrum-master": {
          "$ref": "#/definitions/claude_seat"
        },
        "product-owner": {
          "$ref": "#/definitions/claude_seat"
        },
        "requirements-analyst": {
          "$ref": "#/definitions/claude_seat"
        },
        "developer": {
          "$ref": "#/definitions/claude_seat"
        },
        "pbi-designer": {
          "$ref": "#/definitions/claude_seat"
        },
        "pbi-implementer": {
          "$ref": "#/definitions/claude_seat"
        },
        "pbi-ut-author": {
          "$ref": "#/definitions/claude_seat"
        },
        "integrity-reviewers": {
          "$ref": "#/definitions/claude_seat"
        },
        "codex-reviewers": {
          "$ref": "#/definitions/codex_seat"
        }
      }
    }
  },
  "definitions": {
    "claude_seat": {
      "description": "A seat served by Claude Code. model = CLI alias or full model id (same token alphabet as scrum-start.sh is_safe_model_token); effort = Claude Code effort level (validated against model-catalog.json providers.claude.efforts by the wrapper).",
      "type": "object",
      "additionalProperties": false,
      "required": [
        "provider",
        "model"
      ],
      "properties": {
        "provider": {
          "enum": [
            "claude"
          ]
        },
        "model": {
          "type": "string",
          "pattern": "^[A-Za-z0-9][A-Za-z0-9._/-]*$"
        },
        "effort": {
          "type": "string",
          "pattern": "^[a-z]+$"
        }
      }
    },
    "codex_seat": {
      "description": "A seat served by the OpenAI Codex CLI. model null = the CLI default (no -m flag). effort is not a Codex CLI flag and is rejected rather than silently ignored.",
      "type": "object",
      "additionalProperties": false,
      "required": [
        "provider",
        "model"
      ],
      "properties": {
        "provider": {
          "enum": [
            "codex"
          ]
        },
        "model": {
          "type": [
            "string",
            "null"
          ],
          "pattern": "^[A-Za-z0-9][A-Za-z0-9._-]*$"
        }
      }
    }
  }
}
