{
  "test_runner": {
    "command": "pytest",
    "args": ["--tb=short", "-q"],
    "results_format": "junit",
    "results_path_template": ".scrum/pbi/{pbi_id}/metrics/test-results-r{round}.xml"
  },
  "coverage_tool": {
    "command": "coverage",
    "run_args": ["run", "--branch", "--source=src", "-m", "pytest"],
    "report_args": ["json", "-o"],
    "report_path_template": ".scrum/pbi/{pbi_id}/metrics/coverage-r{round}.json",
    "supports_branch": true
  },
  "pragma_pattern": "pragma: no cover",
  "c0_threshold": 100,
  "c1_threshold": 100,
  "path_guard": {
    "impl_globs": ["src/**", "lib/**"],
    "test_globs": ["tests/**", "**/*_test.py"]
  },
  "merge_regression": {
    "command": "pytest --tb=short -q"
  },
  "static_analysis": {
    "commands": [
      {"name": "vulture", "command": "vulture src/ --min-confidence 80"}
    ]
  },
  "stall_watchdog": {
    "enabled": true,
    "idle_threshold_minutes": 30,
    "pbi_idle_threshold_minutes": 30,
    "cooldown_minutes": 15,
    "poll_interval_seconds": 60
  },
  "po_mode": "human",
  "po": {
    "max_clarification_rounds": 2,
    "max_integration_cycles": 3
  },
  "agents": {
    "scrum-master": {"provider": "claude", "model": "opus", "effort": "high"},
    "product-owner": {"provider": "claude", "model": "opus", "effort": "xhigh"},
    "requirements-analyst": {"provider": "claude", "model": "opus", "effort": "high"},
    "developer": {"provider": "claude", "model": "sonnet", "effort": "high"},
    "codex-reviewers": {"provider": "codex", "model": null},
    "pbi-designer": {"provider": "claude", "model": "opus", "effort": "high"},
    "pbi-implementer": {"provider": "claude", "model": "opus", "effort": "high"},
    "pbi-ut-author": {"provider": "claude", "model": "opus", "effort": "high"},
    "integrity-reviewers": {"provider": "claude", "model": "opus", "effort": "xhigh"}
  },
  "autonomous": {
    "max_iterations": 50,
    "max_wall_clock_hours": 8,
    "max_sprints": 8,
    "max_consecutive_failures": 3,
    "stop_block_budget_per_phase": 8,
    "permission_mode": "dontAsk",
    "notify_command": null,
    "fallback_model": null
  }
}
